{
  "source": "src/dynamic/lists/sekundaerliteratur/1997_Haag_1.html",
  "Jahr": 1997,
  "Autor": "Haag",
  "Sort": 1,
  "Eintrag": "**Haag**, Ingrid: Die Dramaturgie der Verschiebung im „Hofmeister“ von Lenz. Oder: Über die Konstellation von Lücke und Glück. In: Études Germaniques (Paris), Année 52 (1997), Nr. 1: J. M. R. Lenz, S. 113-130."
}
