{
  "source": "src/dynamic/lists/sekundaerliteratur/2001_Goltschnigg_1.html",
  "Jahr": 2001,
  "Autor": "Goltschnigg",
  "Sort": 1,
  "Eintrag": "**Goltschnigg**, Dietmar (Hrsg.): Georg Büchner und die Moderne. Texte, Analysen, Kommentar. 3 Bde. Berlin: Erich Schmidt 2001-2004.",
  "Kommentare": [
    "Bd. 1 (2001): 1875-1945. 616 S. – Bd. 2 (2002): 1945-1980. 648 S. – Bd. 3 (2004): 1980-2002. 778 S.",
    "Lenz-Bezüge vgl. Reg."
  ]
}
